{
    "$schema": "http://json-schema.org/draft-07/schema#",
    "$id": "https://raw.githubusercontent.com/dedis/student_21_pop/master/protocol/query/method/message/data/dataCastVote.json",
    "description": "Match a cast vote query",
    "type": "object",
    "properties": {
        "object": {
            "const": "election"
        },
        "action": {
            "const": "cast_vote"
        },
        "lao": {
            "type": "string",
            "contentEncoding": "base64",
            "$comment": "ID of the LAO"
        },
        "election": {
            "type": "string",
            "contentEncoding": "base64",
            "$comment": "ID of the election"
        },
        "created_at": {
            "description": "[Timestamp] time created in UTC",
            "type": "integer",
            "minimum": 0
        },
        "votes": {
            "description": "Array of votes",
            "type": "array",
            "items": {
                "type": "object",
                "allOf": [
                    {
                        "properties": {
                            "id": {
                                "type": "string",
                                "contentEncoding": "base64",
                                "$comment": "Hash : HashLen('Vote', election_id, question_id, (vote_index(es)|write_in)), concatenate vote indexes - must use delimiter"
                            },
                            "question": {
                                "type": "string",
                                "contentEncoding": "base64",
                                "$comment": "ID of the question"
                            }
                        },
                        "required": ["id", "question"]
                    },
                    {
                        "oneOf": [
                            {
                                "properties": {
                                    "vote": {
                                        "description": "[Array[Integer]] index(es) corresponding to the ballot_options",
                                        "type": "array",
                                        "items": {
                                            "type": "integer",
                                            "$comment": "vote index"
                                        },
                                        "minItems": 1,
                                        "uniqueItems": true
                                    }
                                },
                                "required": ["vote"]
                            },
                            {
                                "properties": {
                                    "write_in": {
                                        "type": "string"
                                    }
                                },
                                "required": ["write_in"]
                            }
                        ]
                    }
                ]
            },
            "minItems": 1,
            "uniqueItems": true
        }
    },
    "additionalProperties": false,
    "required": ["object", "action", "lao", "election", "created_at", "votes"]
}
