{
    "object": "election",
    "action": "cast_vote",
    "lao": "fzJSZjKf-2cbXH7kds9H8NORuuFIRLkevJlN7qQemjo=",
    "election": "JVehtpaFJwPc2dp8VuiskXwxmjTQGT6OiIVbei-EbBI=",
    "created_at": 1633098941,
    "votes": [
        {
            "id": "JF8pLNhK6BArJpZxL7IWhbC6doPDpGPClRkgav0ry_0=",
            "question": "AQy6JrPiLXG7oIZ_EL83hbs87w_vjn5ZS3r4je1wV8o=",
            "vote": [0]
        }
    ]
}
