{
    "object": "election",
    "action": "cast_vote",
    "lao": "fzJSZjKf-2cbXH7kds9H8NORuuFIRLkevJlN7qQemjo=",
    "election": "QWTmcWMMMiUdWdZX7ib7GyqH6A5ifDYwPaMpKxIZm1k=",
    "created_at": 1633098996,
    "votes": [
        {
            "id": "DtIsj7nQ0Y4iLJ4ETKv2D0uah7IYGyEVW7aCLFjaL0w=",
            "question": "WBVsWJI-C5YkD0wdE4DxnLa0lJzjnHEd67XPFVB9v3g=",
            "write_in": "Computer Science"
        }
    ]
}
